{
  "baseline": [
    [
      "0",
      "1",
      "0",
      "0",
      "0",
      "0"
    ],
    [
      "0",
      "1/2",
      "1/6",
      "0",
      "1/3",
      "0"
    ],
    [
      "0",
      "0",
      "0",
      "1",
      "0",
      "0"
    ],
    [
      "0",
      "0",
      "1",
      "0",
      "0",
      "0"
    ],
    [
      "0",
      "0",
      "0",
      "0",
      "1/2",
      "1/2"
    ],
    [
      "0",
      "0",
      "0",
      "0",
      "1/4",
      "3/4"
    ]
  ],
  "comparison": [
    1,
    2
  ],
  "descriptor": [
    false,
    false,
    true,
    true,
    true,
    true
  ],
  "menu": [
    {
      "id": "full",
      "matrix": [
        [
          "0",
          "1",
          "0",
          "0",
          "0",
          "0"
        ],
        [
          "0",
          "1",
          "0",
          "0",
          "0",
          "0"
        ],
        [
          "0",
          "1",
          "0",
          "0",
          "0",
          "0"
        ],
        [
          "0",
          "0",
          "1",
          "0",
          "0",
          "0"
        ],
        [
          "0",
          "0",
          "0",
          "0",
          "1/2",
          "1/2"
        ],
        [
          "0",
          "0",
          "0",
          "0",
          "1/4",
          "3/4"
        ]
      ]
    },
    {
      "id": "half",
      "matrix": [
        [
          "0",
          "1",
          "0",
          "0",
          "0",
          "0"
        ],
        [
          "0",
          "1",
          "0",
          "0",
          "0",
          "0"
        ],
        [
          "0",
          "1/2",
          "0",
          "0",
          "1/2",
          "0"
        ],
        [
          "0",
          "0",
          "1",
          "0",
          "0",
          "0"
        ],
        [
          "0",
          "0",
          "0",
          "0",
          "1/2",
          "1/2"
        ],
        [
          "0",
          "0",
          "0",
          "0",
          "1/4",
          "3/4"
        ]
      ]
    },
    {
      "id": "tiny",
      "matrix": [
        [
          "0",
          "1",
          "0",
          "0",
          "0",
          "0"
        ],
        [
          "0",
          "1",
          "0",
          "0",
          "0",
          "0"
        ],
        [
          "0",
          "1/1000",
          "0",
          "0",
          "999/1000",
          "0"
        ],
        [
          "0",
          "0",
          "1",
          "0",
          "0",
          "0"
        ],
        [
          "0",
          "0",
          "0",
          "0",
          "1/2",
          "1/2"
        ],
        [
          "0",
          "0",
          "0",
          "0",
          "1/4",
          "3/4"
        ]
      ]
    },
    {
      "id": "identity",
      "matrix": [
        [
          "0",
          "1",
          "0",
          "0",
          "0",
          "0"
        ],
        [
          "0",
          "1/2",
          "1/6",
          "0",
          "1/3",
          "0"
        ],
        [
          "0",
          "0",
          "0",
          "1",
          "0",
          "0"
        ],
        [
          "0",
          "0",
          "1",
          "0",
          "0",
          "0"
        ],
        [
          "0",
          "0",
          "0",
          "0",
          "1/2",
          "1/2"
        ],
        [
          "0",
          "0",
          "0",
          "0",
          "1/4",
          "3/4"
        ]
      ]
    },
    {
      "id": "u-only",
      "matrix": [
        [
          "0",
          "1",
          "0",
          "0",
          "0",
          "0"
        ],
        [
          "0",
          "1",
          "0",
          "0",
          "0",
          "0"
        ],
        [
          "0",
          "0",
          "0",
          "1",
          "0",
          "0"
        ],
        [
          "0",
          "0",
          "1",
          "0",
          "0",
          "0"
        ],
        [
          "0",
          "0",
          "0",
          "0",
          "1/2",
          "1/2"
        ],
        [
          "0",
          "0",
          "0",
          "0",
          "1/4",
          "3/4"
        ]
      ]
    },
    {
      "id": "b-only",
      "matrix": [
        [
          "0",
          "1",
          "0",
          "0",
          "0",
          "0"
        ],
        [
          "0",
          "0",
          "0",
          "0",
          "1",
          "0"
        ],
        [
          "0",
          "0",
          "0",
          "0",
          "1",
          "0"
        ],
        [
          "0",
          "0",
          "1",
          "0",
          "0",
          "0"
        ],
        [
          "0",
          "0",
          "0",
          "0",
          "1/2",
          "1/2"
        ],
        [
          "0",
          "0",
          "0",
          "0",
          "1/4",
          "3/4"
        ]
      ]
    }
  ],
  "n": 6
}
